{
  "schema_version": "agent-workflow-worker-state.v1",
  "state_kind": "worker_state",
  "worker_state_path": "runtime/agent-workflow/agent-workflow-dirty-triage/workers/worker-pr-363/worker-state.v1.json",
  "worker_id": "worker-pr-363",
  "goal_id": "agent-workflow-dirty-triage",
  "role": "bears-development-workflow-orchestrator",
  "lane": "implementation",
  "active_parallel_agent": true,
  "assignment_ref": {
    "kind": "worker_assignment",
    "ref": "assignment:worker-pr-363",
    "source": "metadata_only",
    "path": "runtime/agent-workflow/agent-workflow-dirty-triage/workers/worker-pr-363/assignment.json",
    "digest": "not_recorded",
    "requires_network": false,
    "note": "Assignment is local metadata for a parallel worker."
  },
  "status": "running",
  "heartbeat": {
    "packet_ref": {
      "kind": "worker_heartbeat",
      "ref": "heartbeat:worker-pr-363",
      "source": "metadata_only",
      "path": "runtime/agent-workflow/agent-workflow-dirty-triage/workers/worker-pr-363/heartbeat.json",
      "digest": "not_recorded",
      "requires_network": false,
      "note": "Heartbeat hook writes the worker state only."
    },
    "status": "running",
    "last_seen": "2026-06-21T00:00:00Z",
    "active": true,
    "open_pr_refs": [
      {
        "kind": "open_pr",
        "ref": "github-pr:363",
        "source": "metadata_only",
        "path": "runtime/agent-workflow/agent-workflow-dirty-triage/workers/worker-pr-363/open-pr.json",
        "digest": "not_recorded",
        "requires_network": false,
        "note": "Open draft PR #363 proves active tracked work without network calls."
      }
    ]
  },
  "scope_lock_ref": {
    "kind": "scope_lock",
    "ref": "scope-lock:worker-pr-363",
    "source": "metadata_only",
    "path": "runtime/agent-workflow/agent-workflow-dirty-triage/workers/worker-pr-363/scope-lock.json",
    "digest": "not_recorded",
    "requires_network": false,
    "note": "Scope lock is local metadata for owned files."
  },
  "dirty_inventory_refs": [
    {
      "item_id": "dirty-pr-363-worktree",
      "path": ".",
      "category": "worktree",
      "protected_by": [
        "heartbeat",
        "scope_lock",
        "open_pr",
        "worker_closeout_missing",
        "validation_evidence_missing",
        "current_worktree",
        "backup_branch"
      ],
      "proof_refs": [
        {
          "kind": "worker_heartbeat",
          "ref": "heartbeat:worker-pr-363",
          "source": "metadata_only",
          "path": "runtime/agent-workflow/agent-workflow-dirty-triage/workers/worker-pr-363/heartbeat.json",
          "digest": "not_recorded",
          "requires_network": false,
          "note": "Active heartbeat protects this worker state."
        },
        {
          "kind": "open_pr",
          "ref": "github-pr:363",
          "source": "metadata_only",
          "path": "runtime/agent-workflow/agent-workflow-dirty-triage/workers/worker-pr-363/open-pr.json",
          "digest": "not_recorded",
          "requires_network": false,
          "note": "Open PR protects tracked work."
        },
        {
          "kind": "backup_branch",
          "ref": "branch:backup/agent-workflow-dirty-triage-pr-363",
          "source": "metadata_only",
          "path": "runtime/agent-workflow/agent-workflow-dirty-triage/workers/worker-pr-363/backup-branch.json",
          "digest": "not_recorded",
          "requires_network": false,
          "note": "Backup branch metadata exists before cleanup authority can change."
        }
      ]
    }
  ],
  "closeout_ref": null,
  "validation_evidence_refs": [
    {
      "kind": "validation_evidence",
      "ref": "validation:worker-pr-363:pending",
      "source": "metadata_only",
      "path": "runtime/agent-workflow/agent-workflow-dirty-triage/workers/worker-pr-363/validation-evidence.json",
      "digest": "pending",
      "requires_network": false,
      "note": "Validation evidence is pending until worker closeout."
    }
  ],
  "integration_status": {
    "state": "waiting_for_validation",
    "active_pr_tracked": true,
    "aggregate_index_refreshed": true,
    "blocked_by": [
      "worker_closeout_missing",
      "validation_evidence_pending"
    ]
  },
  "cleanup_authority": {
    "authority": "no_cleanup_until_resolved",
    "action_allowed": false,
    "reason": "Active parallel worker has heartbeat and open draft PR #363; closeout is missing.",
    "protected_by": [
      "heartbeat",
      "scope_lock",
      "open_pr",
      "worker_closeout_missing",
      "validation_evidence_missing"
    ]
  },
  "hook_events": [
    {
      "event_id": "hook-pre-task-worker-pr-363",
      "event_type": "pre_task",
      "write_scope": "own_worker_state",
      "target_path": "runtime/agent-workflow/agent-workflow-dirty-triage/workers/worker-pr-363/worker-state.v1.json",
      "requires_network": false,
      "status": "written",
      "note": "pre_task hook records assignment and scope before work."
    },
    {
      "event_id": "hook-heartbeat-worker-pr-363",
      "event_type": "heartbeat",
      "write_scope": "own_worker_state",
      "target_path": "runtime/agent-workflow/agent-workflow-dirty-triage/workers/worker-pr-363/worker-state.v1.json",
      "requires_network": false,
      "status": "written",
      "note": "heartbeat hook refreshes only this worker state file."
    },
    {
      "event_id": "hook-closeout-worker-pr-363",
      "event_type": "closeout",
      "write_scope": "own_worker_state",
      "target_path": "runtime/agent-workflow/agent-workflow-dirty-triage/workers/worker-pr-363/worker-state.v1.json",
      "requires_network": false,
      "status": "planned",
      "note": "closeout hook will write only this worker state file."
    },
    {
      "event_id": "hook-aggregate-index-refresh-worker-pr-363",
      "event_type": "aggregate_index_refresh",
      "write_scope": "aggregate_index",
      "target_path": "runtime/agent-workflow/agent-workflow-dirty-triage/workflow-state.v1.json",
      "requires_network": false,
      "status": "written",
      "note": "aggregate_index_refresh is the only hook modeled to update the root index."
    }
  ]
}
